{
  "created_at": "2026-10-14T00:12:21.868749Z",
  "current_derivation_id": "audit-categories-0022-fibre-examples-20261014",
  "files": {
    "candidates": {
      "hash": "sha256:afbc3bdaf11c13fef7cdb5e9e22afafcff4980bfb886a341286c1bff38d3b4ab",
      "path": "translation-data/retired/pre-adoption-replays/pre-adoption-categories-0022-fibre-examples-20261014/candidates.jsonl"
    },
    "derivation": {
      "hash": "sha256:3a84ec5748a2428ae9d1eb87fd8ddb9522d5c9904938f349570072f3da7a2acb",
      "path": "translation-data/retired/pre-adoption-replays/pre-adoption-categories-0022-fibre-examples-20261014/derivation.json"
    },
    "units": {
      "hash": "sha256:f4372021666abed7c784007a13e66e92719df3858baf4f9f07ddd6177a9698e9",
      "path": "translation-data/retired/pre-adoption-replays/pre-adoption-categories-0022-fibre-examples-20261014/units.jsonl"
    }
  },
  "origin_commit": "60b14fe7d608a0142b825f7a37f79b13824ce006",
  "output_unit_ids": [
    "tag:0022:statement",
    "tag:0022:proof"
  ],
  "predecessor_correction_id": "categories-fibre-examples-gpt61sol-20261014",
  "replay_id": "pre-adoption-categories-0022-fibre-examples-20261014",
  "schema_version": 1,
  "source_commit": "a04446e57ec1fbc252a871afcec7752fb2807b14",
  "successor_correction_id": "categories-fibre-examples-gpt61sol-20261014-complete",
  "tool_version": "pre-adoption-replay-v1"
}
